{
  "externalId": "114117922233599",
  "orderStatus": "OPEN",
  "locationCode": "123456789",
  "createDate": "2023-04-25 20:09:01",
  "createEmployeeCode": "ee1bf88e-2137-4a17-835a-d43e7b738374",
  "shipmentType": "CUSTOMER",
  "deliveryType": "SCHEDULED",
  "orderPickType": {
    "willCallPickUp": true,
    "phoneNumber": "987654321"
  },
  "shippingMethod": "FEDEX",
  "productCategory": "REFRIGERATED",
  "desiredShippingDate": "2025-12-31",
  "shippingCustomerCode": "99741",
  "billingCustomerCode": "99741",
  "comments": "Red Blood Cells for A+",
  "orderItems": [
    {
      "productFamily": "RED_BLOOD_CELLS",
      "bloodType": "AP",
      "quantity": 1,
      "comments": "Comments"
    }
  ]
}
