{
  "externalId": "114117922233598",
  "orderStatus": "OPEN",
  "locationCode": "123456789",
  "createDate": "2023-04-25 20:09:01",
  "shipmentType": "CUSTOMER",
  "deliveryType": "SCHEDULED",
  "orderPickType": {
    "willCallPickUp": true,
    "phoneNumber": "12333333"
  },
  "shippingMethod": "FEDEX",
  "productCategory": "FROZEN",
  "desiredShippingDate": "2020-04-25",
  "shippingCustomerCode": "99741",
  "billingCustomerCode": "99741",
  "comments": "string",
  "orderItems": [
    {
      "productFamily": "PLASMA_TRANSFUSABLE",
      "bloodType": "AB",
      "quantity": 1,
      "comments": "Comments"
    }
  ]
}
